{"assignment_id":"asg-jer-r8-held-1-literary_form_scout","candidate_only":true,"controller_instance_id":"controller-jer-r8","event_id":"evt-jer-r8-held-1-literary_form_scout-finished","event_kind":"execution_finished","execution_id":"exec-jer-r8-held-1-literary_form_scout","input_manifest_sha256":"sha256:a3f4e7d34595883a5db2c84c9724cb02ad42917e3d893ed6631ff50213f63cfb","non_authorizing":true,"observed_at":"2026-07-22T17:07:07Z","result_digest":"sha256:bf32b32be3a4167b41441047705118f4ebd0783f0045164814c66469055ababb","schema_version":"whole_bible_b01_controller_event.v1"}