{"assignment_id":"asg-isa-r8-held-1-second_temple_rabbinic_context_scout","candidate_only":true,"controller_instance_id":"controller-isa-r8","event_id":"evt-isa-r8-held-1-second_temple_rabbinic_context_scout-finished","event_kind":"execution_finished","execution_id":"exec-isa-r8-held-1-second_temple_rabbinic_context_scout","input_manifest_sha256":"sha256:f6b3103fc5ead90f18c2d439d2c53c9add8f112bccac8e1b3c4601aed3c6c07e","non_authorizing":true,"observed_at":"2026-07-22T17:07:07Z","result_digest":"sha256:810d6cf1fc680353db472abb8ae7d8a43db2a05e9ed5c512cfdd2f1a2bf76e3e","schema_version":"whole_bible_b01_controller_event.v1"}