{"assignment_id":"asg-gen-r8-held-1-original_language_translation_scout","candidate_only":true,"controller_instance_id":"controller-gen-r8","event_id":"evt-gen-r8-held-1-original_language_translation_scout-assigned","event_kind":"assignment_issued","execution_id":"exec-gen-r8-held-1-original_language_translation_scout","input_manifest_sha256":"sha256:760d7b34abbbf22fbd21cc4b660df41c96cd80a2cc0c5b5dc4ea99c424ce4724","non_authorizing":true,"observed_at":"2026-07-22T17:13:30Z","result_digest":"sha256:8870cee15dc14127e2313eb5deb4946d2b06c43f0f5625054c4fc856edbbc662","schema_version":"whole_bible_b01_controller_event.v1"}