{"assignment_id":"asg-jude-r8-held-1-original_language_translation_scout","candidate_only":true,"controller_instance_id":"controller-jude-r8","event_id":"evt-jude-r8-held-1-original_language_translation_scout-received","event_kind":"result_received","execution_id":"exec-jude-r8-held-1-original_language_translation_scout","input_manifest_sha256":"sha256:0be657edbb2e0d513d85a78f06f89667f05d1a3d9230423f9682abfc1b69195b","non_authorizing":true,"observed_at":"2026-07-22T17:09:11Z","result_digest":"sha256:11b918fe196abdf8a3f2af9fee90c3fe32d503d442d4b5ba253b2443e8b134f8","schema_version":"whole_bible_b01_controller_event.v1"}