{"assignment_id":"asg-num-r8-held-1-controller","candidate_only":true,"controller_instance_id":"controller-num-r8","event_id":"evt-num-r8-held-1-manifest","event_kind":"assignment_issued","execution_id":"exec-num-r8-held-1-controller","input_manifest_sha256":"sha256:e707802786851c005d567213dcdf92f184809b21b0b8fcf58d842a62d51749cd","non_authorizing":true,"observed_at":"2026-07-22T17:13:33Z","result_digest":"sha256:e707802786851c005d567213dcdf92f184809b21b0b8fcf58d842a62d51749cd","schema_version":"whole_bible_b01_controller_event.v1"}