{"assignment_id":"asg-isa-r8-held-1-canonical_relations_and_premortem_scout","candidate_only":true,"controller_instance_id":"controller-isa-r8","event_id":"evt-isa-r8-held-1-canonical_relations_and_premortem_scout-received","event_kind":"result_received","execution_id":"exec-isa-r8-held-1-canonical_relations_and_premortem_scout","input_manifest_sha256":"sha256:f6b3103fc5ead90f18c2d439d2c53c9add8f112bccac8e1b3c4601aed3c6c07e","non_authorizing":true,"observed_at":"2026-07-22T17:07:07Z","result_digest":"sha256:575d6daa4dbdefd507d26240029e40c4c18af917f24c111e27675186e5e6b26e","schema_version":"whole_bible_b01_controller_event.v1"}