{"assignment_id":"asg-ruth-r8-held-1-original_language_translation_scout","candidate_only":true,"controller_instance_id":"controller-ruth-r8","event_id":"evt-ruth-r8-held-1-original_language_translation_scout-assigned","event_kind":"assignment_issued","execution_id":"exec-ruth-r8-held-1-original_language_translation_scout","input_manifest_sha256":"sha256:2993d1253aa79e8e2d9989f218f324adeaa7af8e5b7f1ad9bf3dca1fd6a4b8fc","non_authorizing":true,"observed_at":"2026-07-22T17:04:21Z","result_digest":"sha256:851acbd8e5bcfbd035f3ee54f8d5fdef3cb2bce76d76b9537141bf81cfdaccd1","schema_version":"whole_bible_b01_controller_event.v1"}