{"assignment_id":"asg-ezek-r8-held-1-original_language_translation_scout","candidate_only":true,"controller_instance_id":"controller-ezek-r8","event_id":"evt-ezek-r8-held-1-original_language_translation_scout-assigned","event_kind":"assignment_issued","execution_id":"exec-ezek-r8-held-1-original_language_translation_scout","input_manifest_sha256":"sha256:f57f89f9e1672846a429ba92635a243b248bb3b8a038202467c52dba7e7772d5","non_authorizing":true,"observed_at":"2026-07-22T17:07:08Z","result_digest":"sha256:f7346f9c5764d9a2318e2fe3744f58e2634e5263cc492d6891f9b781d1a05481","schema_version":"whole_bible_b01_controller_event.v1"}