{"assignment_id":"asg-zeph-r8-held-1-literary_form_scout","candidate_only":true,"controller_instance_id":"controller-zeph-r8","event_id":"evt-zeph-r8-held-1-literary_form_scout-finished","event_kind":"execution_finished","execution_id":"exec-zeph-r8-held-1-literary_form_scout","input_manifest_sha256":"sha256:9d7cdf8fdf54ba4a49321ecd7bc24b6fee7ee1065a6083ae340f42ad880573a8","non_authorizing":true,"observed_at":"2026-07-22T17:07:12Z","result_digest":"sha256:19fd7bb81db82c02691433adc83f3724e149f25da266f416d0c40deb5921bbd8","schema_version":"whole_bible_b01_controller_event.v1"}