{"assignment_id":"asg-acts-r8-held-1-canonical_relations_and_premortem_scout","candidate_only":true,"controller_instance_id":"controller-acts-r8","event_id":"evt-acts-r8-held-1-canonical_relations_and_premortem_scout-assigned","event_kind":"assignment_issued","execution_id":"exec-acts-r8-held-1-canonical_relations_and_premortem_scout","input_manifest_sha256":"sha256:3bd0cedfe283d913b73d615b208b022bf7e6c6a252ba3b17a9f7307fc8f2a3ba","non_authorizing":true,"observed_at":"2026-07-22T17:09:04Z","result_digest":"sha256:5fba89ee600bf77b67ea10565703ffb9583fee13e03e0a451cc4f4eae701bbcb","schema_version":"whole_bible_b01_controller_event.v1"}