{"assignment_id":"asg-obad-r8-held-1-literary_form_scout","candidate_only":true,"controller_instance_id":"controller-obad-r8","event_id":"evt-obad-r8-held-1-literary_form_scout-assigned","event_kind":"assignment_issued","execution_id":"exec-obad-r8-held-1-literary_form_scout","input_manifest_sha256":"sha256:3ae936ca9118c4722b87c4d03f86cd671729560ea261ef5a800733d3c9f0eba1","non_authorizing":true,"observed_at":"2026-07-22T17:07:10Z","result_digest":"sha256:2b2ecbe663b6bef29e3ed72c7b9973b13e99fe1a400fe2bcaa120c953c65bd0c","schema_version":"whole_bible_b01_controller_event.v1"}