{"assignment_id":"asg-josh-r8-held-1-original_language_translation_scout","candidate_only":true,"controller_instance_id":"controller-josh-r8","event_id":"evt-josh-r8-held-1-original_language_translation_scout-finished","event_kind":"execution_finished","execution_id":"exec-josh-r8-held-1-original_language_translation_scout","input_manifest_sha256":"sha256:a5bf99a9f54dcefb3a4a48a7986dbb542c56efda3cf9cfdb2c1ab605b25c2c3b","non_authorizing":true,"observed_at":"2026-07-22T17:04:20Z","result_digest":"sha256:588c5b6efdd528f73df18cd14af7d07e2a25a078c1bfe8c35ee57f337b54840c","schema_version":"whole_bible_b01_controller_event.v1"}