{"assignment_id":"asg-2chr-r8-held-1-literary_form_scout","candidate_only":true,"controller_instance_id":"controller-2chr-r8","event_id":"evt-2chr-r8-held-1-literary_form_scout-received","event_kind":"result_received","execution_id":"exec-2chr-r8-held-1-literary_form_scout","input_manifest_sha256":"sha256:4dd79c9180a15f6b69f73e4642554afd208855f8ebf605bfb70fb6217976c228","non_authorizing":true,"observed_at":"2026-07-22T17:06:15Z","result_digest":"sha256:18b7107965b857c445a8f631c695db5c56bd8d8418efb31a75cb52d699bb2be8","schema_version":"whole_bible_b01_controller_event.v1"}