{"assignment_id":"asg-1pet-r8-held-1-canonical_relations_and_premortem_scout","candidate_only":true,"controller_instance_id":"controller-1pet-r8","event_id":"evt-1pet-r8-held-1-canonical_relations_and_premortem_scout-received","event_kind":"result_received","execution_id":"exec-1pet-r8-held-1-canonical_relations_and_premortem_scout","input_manifest_sha256":"sha256:247d713d3cb68068af8d80aacbaaae88b3dac57585792dfeb707d41adec9160a","non_authorizing":true,"observed_at":"2026-07-22T17:09:10Z","result_digest":"sha256:df92c6a648cf83fa1a580f0533f841d364d9794bea92f55bac3e25fe03058f19","schema_version":"whole_bible_b01_controller_event.v1"}