{"assignment_id":"asg-jude-r8-held-1-second_temple_rabbinic_context_scout","candidate_only":true,"controller_instance_id":"controller-jude-r8","event_id":"evt-jude-r8-held-1-second_temple_rabbinic_context_scout-received","event_kind":"result_received","execution_id":"exec-jude-r8-held-1-second_temple_rabbinic_context_scout","input_manifest_sha256":"sha256:0be657edbb2e0d513d85a78f06f89667f05d1a3d9230423f9682abfc1b69195b","non_authorizing":true,"observed_at":"2026-07-22T17:09:11Z","result_digest":"sha256:ad0d7eb257ed120bbc9c6414a9eb547281b4c1f3f85b8bcc22028fbee6a3c9c6","schema_version":"whole_bible_b01_controller_event.v1"}