{"assignment_id":"asg-job-r8-held-1-canonical_relations_and_premortem_scout","candidate_only":true,"controller_instance_id":"controller-job-r8","event_id":"evt-job-r8-held-1-canonical_relations_and_premortem_scout-received","event_kind":"result_received","execution_id":"exec-job-r8-held-1-canonical_relations_and_premortem_scout","input_manifest_sha256":"sha256:f27043758faff9c966a1ccbfdc1e5b0dd12a7f3ad95b5d6e304b9b51a470b483","non_authorizing":true,"observed_at":"2026-07-22T17:07:04Z","result_digest":"sha256:af9abd0012839af53a52451f39c80b4638d7303c23058d333925a2dda549e7b5","schema_version":"whole_bible_b01_controller_event.v1"}