{"assignment_id":"asg-luke-r8-held-1-canonical_relations_and_premortem_scout","candidate_only":true,"controller_instance_id":"controller-luke-r8","event_id":"evt-luke-r8-held-1-canonical_relations_and_premortem_scout-received","event_kind":"result_received","execution_id":"exec-luke-r8-held-1-canonical_relations_and_premortem_scout","input_manifest_sha256":"sha256:20c83f64c3ea17003085e098962372e3a3f344f70c25da6305172f9bc9604ef4","non_authorizing":true,"observed_at":"2026-07-22T17:09:03Z","result_digest":"sha256:48c4cbda5b45c5cdf1a7256b1aa90e1c4bfd6ebdfdd518815100d001be222c9c","schema_version":"whole_bible_b01_controller_event.v1"}