{"assignment_id":"asg-1cor-r8-held-1-original_language_translation_scout","candidate_only":true,"controller_instance_id":"controller-1cor-r8","event_id":"evt-1cor-r8-held-1-original_language_translation_scout-assigned","event_kind":"assignment_issued","execution_id":"exec-1cor-r8-held-1-original_language_translation_scout","input_manifest_sha256":"sha256:afb40711a80e6857d69661e1cf6ad5fc2d2cd9d480b70cbf11291ed60aed8f70","non_authorizing":true,"observed_at":"2026-07-22T17:09:05Z","result_digest":"sha256:5c242922c6ef16bd2f34cfa81d7295914da88b6137173606078c35d2af9f2c7d","schema_version":"whole_bible_b01_controller_event.v1"}