{"assignment_id":"asg-neh-r8-held-1-canonical_relations_and_premortem_scout","candidate_only":true,"controller_instance_id":"controller-neh-r8","event_id":"evt-neh-r8-held-1-canonical_relations_and_premortem_scout-finished","event_kind":"execution_finished","execution_id":"exec-neh-r8-held-1-canonical_relations_and_premortem_scout","input_manifest_sha256":"sha256:7b5088330b5098eb9c27e03f0ff4f8d068b1555ee431ab1e9004391b4b2c4127","non_authorizing":true,"observed_at":"2026-07-22T17:06:16Z","result_digest":"sha256:965f675a6d6c7c65079b4c8c13567a9dcfcc17c91231e1151d079587853c6e11","schema_version":"whole_bible_b01_controller_event.v1"}