{"assignment_id":"asg-3john-r8-held-1-literary_form_scout","candidate_only":true,"controller_instance_id":"controller-3john-r8","event_id":"evt-3john-r8-held-1-literary_form_scout-finished","event_kind":"execution_finished","execution_id":"exec-3john-r8-held-1-literary_form_scout","input_manifest_sha256":"sha256:a1f1a61cfb924287518d432adf0c79c4b2e598cbbfeab82033630d62cfc8e8e8","non_authorizing":true,"observed_at":"2026-07-22T17:09:11Z","result_digest":"sha256:f006a71f9d6d3237ae78299f073baf3a9a633c4624269f76759be072cfaed413","schema_version":"whole_bible_b01_controller_event.v1"}