{"assignment_id":"asg-zeph-r8-held-1-second_temple_rabbinic_context_scout","candidate_only":true,"controller_instance_id":"controller-zeph-r8","event_id":"evt-zeph-r8-held-1-second_temple_rabbinic_context_scout-finished","event_kind":"execution_finished","execution_id":"exec-zeph-r8-held-1-second_temple_rabbinic_context_scout","input_manifest_sha256":"sha256:9d7cdf8fdf54ba4a49321ecd7bc24b6fee7ee1065a6083ae340f42ad880573a8","non_authorizing":true,"observed_at":"2026-07-22T17:07:12Z","result_digest":"sha256:b9263e6df50a946175470b8bbf89321527a3e1a27cda706d60f0644505b5ecc5","schema_version":"whole_bible_b01_controller_event.v1"}