{"assignment_id":"asg-amos-r8-held-1-literary_form_scout","candidate_only":true,"controller_instance_id":"controller-amos-r8","event_id":"evt-amos-r8-held-1-literary_form_scout-assigned","event_kind":"assignment_issued","execution_id":"exec-amos-r8-held-1-literary_form_scout","input_manifest_sha256":"sha256:eff02ce50062362f32040d721994757b83d26ddbfe897fa12494ac527c22c02d","non_authorizing":true,"observed_at":"2026-07-22T17:07:10Z","result_digest":"sha256:eb43748cd4e319f6ab1c9bd0fea92ad14f20217ada58596ec5ddbdc228aebbea","schema_version":"whole_bible_b01_controller_event.v1"}