{"assignment_id":"asg-rom-r8-held-1-canonical_relations_and_premortem_scout","candidate_only":true,"controller_instance_id":"controller-rom-r8","event_id":"evt-rom-r8-held-1-canonical_relations_and_premortem_scout-finished","event_kind":"execution_finished","execution_id":"exec-rom-r8-held-1-canonical_relations_and_premortem_scout","input_manifest_sha256":"sha256:865711c632d5ac3cf7c856b061a50571114e5f2e44333794b3f8167dd117b803","non_authorizing":true,"observed_at":"2026-07-22T17:09:04Z","result_digest":"sha256:d98c6c443f31ce933f0c4b2aafa2289323478f9cf3e4e4a6c0110c304d883462","schema_version":"whole_bible_b01_controller_event.v1"}