{"assignment_id":"asg-deut-r8-held-1-canonical_relations_and_premortem_scout","candidate_only":true,"controller_instance_id":"controller-deut-r8","event_id":"evt-deut-r8-held-1-canonical_relations_and_premortem_scout-finished","event_kind":"execution_finished","execution_id":"exec-deut-r8-held-1-canonical_relations_and_premortem_scout","input_manifest_sha256":"sha256:e4f1091555b8be055c00ced040392f9cbd9b39462c06b8af4dc5b05f945b64bb","non_authorizing":true,"observed_at":"2026-07-22T17:04:20Z","result_digest":"sha256:b1f0ed2e8c3baf3b3adfd70db62b1112ae58a14042b8d898a420a6bc93e37a32","schema_version":"whole_bible_b01_controller_event.v1"}